{
  "$schema": "https://raw.githubusercontent.com/TracerBench/tracerbench/master/packages/cli/tb-schema.json",
  "extends": "../../tbconfig_base.json",
  "plotTitle": "fixtures release",
  "regressionThreshold": "50",
  "fidelity": "medium",
  "controlURL": "file:///Users/malynch/D/tracerbench/packages/cli/test/fixtures/release/index.html",
  "experimentURL": "file:///Users/malynch/D/tracerbench/packages/cli/test/fixtures/release/index.html"
}
